sentiment,text
negative,"Received Mazda instead of Lincoln. Quality is great, just wrong item.  Box said Lincoln, but not what was in box.  Will return for correct item."
positive,"I fit these to my 16 Road Glide.  (don't try at home, it took a little sillicone) the quality and build of them however were perfect and I am sure they are the perfect fitment for the recommended years."
positive,They provide so much clarity I felt blind when I had to drive a rental car for a few days.
negative,Mine only lasted 6 months. now i have RAIN-X SILICONE
positive,So far it has been holding up well.
negative,"Poor quality, broke within a week."
negative,Does not fit advertised application. My truck is 2001 dodge quad cab
positive,Works great for stuff you want to leave in your trunk or anything else. Only issue: it's quite large and takes up over a third of my trunk. When you need the space it's awkward to remove or push to the side.
positive,"true size as charted, love it, excellent deal"
positive,"Great product. Fridge stopped working, replaced the control panel which partially fixed the issue but fridge still wasn’t cooling. Could tell the compressor wasn’t running as it wasn’t vibrating and I just heard occasional clicks. Replaced this relay in about 3 minutes and fridge is working again."
positive,Im not crazy about the smokey lenses on these lights. I prefer clear but my husband like the smokey color. We've been using the lights for a week. It took my husband about an hour to install both. Pretty easy installing. The lights are bright and look great at night.
positive,Great item
positive,Great product. Slim but sturdy. All hardware included. Like the covers over screws to keep the 'blackout' look.
positive,Haven't installed yet but can't wait to see how she's going to look from the back.
positive,"According to the size chart I needed a large, I ordered a large, and it fits perfectly. Snug to my head, I keep my head clean shaven so I imagine if I let my hair grow in this may not fit as great. I’ve seen reviews complaining about “mushroom head” and yeah there’s a bit of that. They don’t advertise as being the thinnest helmet so you kind of have to expect that. I ordered the skull and riders design and it looks great in my opinion. I like the quick release chin strap, I’ve never been a fan of the double ring straps. So this is a 5 star helmet for me!"
positive,"I bought this for my hydroponics garden.  I have to switch out the water and nutrients every so often and it gets kind of messy.  This has made the process so much easier.  Instead of having to lift the bucket to dump it out, I can use this to siphon it out into another bucket.  It works equally well for large or small volumes.  The battery life is great and I haven't even needed to change them yet.  I plan to buy another one for our rv."
positive,"Works like a charm and replaces the very dim lights that come stock with Subarus. It wasn't super easy to install them and we had to loosen the battery and air filter compartment, but we got them in and they are so much of an improvement for night driving. Nothing is going to match the power of Xenons (I was spoiled because I had them on my 2012 Mini) but these are a close 2nd. As for longevity, I can't say because we put them in a week ago, but hopefully since they are LEDs, they'll last a good long time."
positive,"This was a gift, but the recipient was happy I got the soft brushes as they felt they would use them more."
positive,"This sun screen is the best we have purchased ever. Fits like a glove, Saturday and best of all it really works good."
positive,Much cheaper than ordering a whole new fob.  Fit perfectly for 2011 Honda Odyssey.
negative,"One of those things like insurance or a standing army you hope you never have to use. It meets the requirements of Hawaii trailer rules. and  is an inexpensive way to do that.<br /><br />For my heavier trailers I use 5/16 grade 70 bulk chain with no extra welds terminated with 6 inch dual lock clips that are like a double safety pistol that requires two actions to allow the trigger to drop the hammer.<br /><br />This safety chain is adequate if you follow the chain rules of cross under hook up that gives minimal play if coupler fails while giving maximum turning angle.<br /><br />The obvious shortcomings with this chain hook and strength is that it is conceivable that the hook could jump out of the receiver due to impact of some kind.  Probably never happen to me but bad things do happen like blow outs that make the wild ride of Mr. Toad seem tame.<br /><br />Curt sells chains and hooks that are more desirable and if you look at the difference in ratings between use and test strengths. this should be your guidelines.  2000 pound trailer = 20,000 pound hitch and safety chains. is a good number to live by."
positive,Works great - bought 3 of them
positive,Worked perfectly. Exact replacement.
positive,"These are good wipers, but difficult to install. I don't know why they make the directions so difficult. As if anybody could understand the drawings on the back of the package. Once on, they work well, no squeaking, and I like the flippy end."
positive,these things work perfect for my 350 center bolt valve covers and all my plug wires are nice and neat.<br />im super happy with this purchase and price.
positive,"I like it and it seems to be exactly what I ordered. The red trim gives it a sleek and edgy look! I have the 2018 Honda Civic Hatchback and all the pieces fit perfectly. Be aware of the fact the main front area and driver section have their own kit and the back seats and doors have their own kit as well. What was confusing is there was one part for the center console that actually was part of the backseat kit (it is the larger sliding coin tray not the small coin tray if that makes sense). My only critique is that the liners for the back cupholders don't stick in place when you put the cupholder rest up (granted I am not planning on using the back cupholders and will use this as a seat for friends). The liner falls out when the cupholder rest is put up so I took it out. Otherwise this is a very slick and affordable way to add more style, color and get a first line of defense to sweaty or leaky cups. I plan on owning this car for at least 5yrs and know how much corrosion can happen if you don't take care of the inside of the car."
positive,"Excellent quality, love the real carbon and love the lock nut thread-on design."
positive,great product
positive,Check engine light and all others gone. Great price and not to hard to install.
negative,"Ordered these not too long ago as the mirrors on my 2009 F350 needed replaced. Put them on today and the running lights don’t work, heated mirrors don’t work, electric tow mirrors do not work, and electric adjustment does not work. I’m very disappointed."
positive,VERY BRIGHT.
positive,"I've had this fridge for just about a year now and it is fantastic. I like the fact that it's not metal so it's tough and won't dent. The thermostat works great and it keeps food cold. I've traveled in my Westfalia with this fridge for a month at a time - there's no comparison to the built-in fridge. It's quiet enough although you can hear it turn on at night. Not so loud as to be a problem. I use it with a very small gel battery and a small solar panel. If the panel is out all day then the battery will keep the fridge going for 36 hours or so.<br /><br />There is a gradient in the temperature inside the fridge from bottom to top. This actually works out really well for me as I put items like milk, cheese, meat, etc at the bottom and fruit and veggies at the top. It's performed consistently in temperatures over 100 degrees. Highly recommended."
negative,It’s so pretty but doesn’t fit on my 2018 Ford Escape. I am so disappointed this didn’t work. I will be returning it tomorrow sadly.
positive,Good
positive,They are easy to install and tight fit. No worries of the coming off. The chrome is very shiney. Compared to dealer OEM of $140 these were a no brainer.
positive,"I purchased this case to store our Hulkman charger in and the charger and it’s accessories fit perfectly. The case will protect the charger well while it is stored in the car. I do wish the instruction manual for the charger fit in the case as well. The case has a nylon zipper that I hope will hold up over time. That being said, it is a nice case for a Hulkman."
positive,"I wanted to put it on my Prius, but other than mounting it on the roof, I couldn't find a spot. I put it on my F-150. This puppy is LOUD!!!"
positive,Awesome organization for The car with grandchildren!
positive,I needed a new door handle because mines broke...fits perfect and i can finally open my door from the inside again!
positive,"I have a SentrySafe pistol safe that was no longer lifting the lid after the strut slowly failed. Tried this one and it worked great. You don;t even have to unscrew the whole strut from the safe, you just unscrew the end pieces to remove old strut, and remove end pieces on new one and screw it into end pieces attached to the lid and base."
positive,"After putting up with my visor falling down, a  quick fix from YouTube. A 5 minute install. So glad this vlmpany developed this little device. It works extremely well! Probably have to wait several months for a Mopar fix. Parts are  all on on back order. So pleased with this product. Buy it! Keep it in the glove box. This is a common design flaw for newer Wranglers & Gladiators. Highly recommended seller."
negative,Image used through no fault of the sellers are incorrect SmittyBilt uses the same image for all their light bars which causes a misleading impression and representation of their product.<br /><br />The Light Bar shown is for a Tacoma and the actual Light bar model shown is number 150010
positive,Great
negative,"Basic and effective on tires, but does not have the accuracy required to be a depth gauge for woodworking as I'd hoped.  That is not a bad thing at all, but don't expect more."
positive,Brackets are good for light bar but small lights are crap.
negative,"Description says that these would fit a Hyundai Tucson. Not true. Even after cutting, these mats are so large and out of shape that the deep cup shape where liquids or snow are supposed to get trapped just folds and so the purpose gets defeated.<br />It is important for the description to be more accurate.  I don't know if I will try to return because of the false description because I cut these already. Waste of money.<br />These will definitely fit a large truck. My big issue is with the sellers saying it will fit my vehicle and this is just not true."
positive,"This is a great replacement if you have the original that's in bad shape, but the key is still good.<br />This unit comes apart easily, original fob pretty much needs to be destroyed to gain access to battery circuitry and sensor, asking with key.<br />Then you can transplant original inner components to this fob.<br />I had to use original key keeper pin also, as the new one supplied with this fob was to tight to go thru key and work correctly. After it was all reassembled it's worked perfectly and a far cry cheaper than replacement from Kia!!"
positive,They are being used in the car and the bike just what I needed.
positive,"Bough this product to try it out in comparison to Bug Slide and it does ok.<br />I prefer bug slide over this, but this product is fine.  It leaves a bit of a streak if you use too much"
positive,Looks good
positive,"I've had these on my car for quite a while now. Some are peeling only because I'm terrible at placing stickers. Most are still there, dirt and all. I love these so much."
negative,Out of the four bulbs only one worked and it was very dim.
positive,Did a great job on my work shoes. Performed as claimed.
positive,"07 Ranger, 6' bed. Fit perfect and easy to put on."
positive,Everything came with the kit to install
positive,Fit 2005 F250 single alternator no problem...appears to be a sturdy belt very similar to factory one.  Will purchase again if needed
positive,I purchased this mitt to clean my new car. It is well made and works very well. I have a ceramic coating on my car and use premium car washing products.  This is the perfect mitt to wash your car safely and thoroughly.
positive,Received on time as advertise.  Works well.
negative,This item is horrible.  Doesn’t have enough power to turn a car or motorcycle over and start.  Doesn’t charge either.  Not sure why a company would make this or amazon sell it
positive,"When a chance the mirror  i do not think it will be ok, but it was excellent, not diferences from the original, the visio is super like the another before . The same item selected, on time"
negative,"I have several Thule products that do a good job for me, so I bought this with confident expectations.  I was soon let down in many ways.<br />+ The straps were sometimes hard to pull into a useful position to secure the bike, and due to poorly designed ends sometimes nearly impossible to release with even slightly sweaty hands.  Worse, the anti-sway does not work at all without the strap (cheap plastic parts pulled apart at joints due to poor design and worse material selection, in this Mechanical Engineer's experienced opinion) and if you use the crude strap you've made an already cumbersome even more so even before you figure out what to do with 6 feet of extra strap (if you only mounted one bike)!<br /><br />Yes, it is light.  Yes, it is Aero.  Yes, it is expensive (!) and Yes, my 15 year old Yakima rack still does a much better job despite its weight, etc.  The new uber-rack has been returned for refund."
positive,I use it to cover small cracks on the fiberglass parts of my motorhome.  I mainly want to keep water out until I can get it repaired.  This should do it.
positive,"Great product and fair price , just happy that you have it all the time and delivery took awhile but we knew<br />we would get specially during Covid-19 !! Thank you"
positive,I installed this 12 months ago and so far no leaks. I think it's held up long enough to say it's worth it in my mazda 3.
negative,"It is not one of the best, but it gets the job done. If you want a quality product, then go with the 3M"
positive,I'm ASE certified auto mechanic with 30yrs of experience.<br />In short. These brake rotors and carbon pads are superior to your standard brake replacement parts.<br />Metallurgy and design of the rotors reduce warping and heat glazing. Carbon pads handle higher braking temps  and reduced brake dust. Price point is very reasonable to quality and performance.
positive,"Purchased in 2010, lasted till about 2016 and totally useless two years later in 2018. Can't really complain as it stayed on the bike through numerous snow storms and hurricanes. Buying a replacement and can only hope it's as good as or better than than the first one."
negative,Lasted only a year. Medal and welds were so cracked I almost lost my tire! Thankfully I didn't lose my spare tire going down the road. VERY POOR PRODUCT!
positive,"Great product, especially for high-temperature applications."
positive,So Far doing Great.<br />This  fit my 1998 Chevy Tahoe 350 5.7 L SBC perfectly.<br />I would of given a 5 star. But it does NOT have the Alinement mark at the bottom of the shaft.<br />But there are many other ways to aline prior to your 1st drop.<br />The hold down clamp is super tight for a reason this sets your timing perfectly. Hold the distributor in hand Aline the clamp on the right spot for your engine TAP the clamp with a hammer & it will slip on.<br />Not getting any misfire codes and truck is running smooth. I would buy again or recommend to a friend.
positive,Good quality yellow bulbs at a great price. No need to buy PIAA bulbs at 15x's the price! Long lasting bulbs too.
positive,Good quality and perfect fitament
positive,Great product. They work just as described. I use them to trailer my 400 lb Suzuki SV 650
positive,Great upgrade part.
positive,Great
positive,"Someone mentioned staples, but they're on the bottom and you can't see them.  Riding is 3 times more comfortable now.  I didn't realize how much my neck and shoulders bothered me not being able to lean back.  Imagine no back rest in your car's seat.....yuck!  It was VERY easy to install.  It mounts where your strap mounts and has about an inch of adjustment fwd and back."
positive,"Perfect fit, 30 second install"
positive,Had these on my car for about 3 weeks now and seem to be doing a great job considering the pot holes I could not avoid.  Nice and tight ride and seem to be performing up to par.  They were also a perfect fit and a great price.
positive,Great for tires and vinyl interior surfaces such as dash boards.
positive,This was a perfect fit for my 2007 Infiniti FX35.. and a fraction of the price of a new unit from the dealer.  This actually feels like a better quality version of the OEM one from the dealer.  Highly recommended!
negative,"The light is fine, except for the additional pieces (parts)that are used to install  it are very cheap and flimsy."
positive,If you own a trailer or motor home and it has a black tank you want to own this!  Works awesome and it allows you to see what’s all coming out but more importantly when the flush is clear water.  You will be amazed and after you do the back flush which this allows how much more junk was still in your tank.  Easy to use it just takes a little longer...  Hook up the water hose to it and let it back fill your black tank and let it rip you will be shocked how much more junk comes out!
positive,I bought these as a repacment for my old led turn signals after i low sided they work well and havent had any problems with them they are also easy to wire
positive,I was pleasantly pleased with these! Definitely exceded my expectations for the lower price!!<br /><br />Very thick and heavy duty (heavy in weight too)<br />Nice clean lines - everything looked as it should<br />Nice product packaging too!<br />I purchased these as a gift and they loved them!<br /><br />Very happy - would recommend
positive,"This is GREAT!!!  I bought for the extra jumping power and yet, I've used the air compressor several times already.  Very solid, sturdy machine that I keep in the trunk even though I have an auto service.  This beats waiting around for quick, simple trouble."
negative,"OK, so after some 15 years of seeing my car chew through ultra bright H7 headlight bulbs like there is no tomorrow (mostly the Sylvania Silverstar Ultra, typical life span 4 to 6 months), I decided to do a test. Purchased a double-pack these Nighthawk Platinums and a double pack of the Sylvania Silverstar Ultra H7 bulbs, and installed one of each in the car the same day. 2001 BMW 325i, no daytime running lights, but I switch on the headlights nearly 100% of the time. I did see no discernible difference in brightness or color, neither looking at the headlights from the outside, nor looking out onto the illuminated road at night. Now, they have both failed, and here are the results:<br />Sylvania Silverstar Ultra lasted for 166 days/3806 miles.<br />The GE Nighthawk Platinum lasted for 123 days/2963 miles.<br />That's a 28% advantage for the Sylvania over the GE based on miles driven (and a 35% advantage based on days, but that's probably less meaningful). Now the second set of bulbs is installed with the positions switched (driver/passenger). Let's see if the result is reproducible. I'll edit my review when the data is in.<br />DAD of 2 boys"
negative,"It's an universal cat, so don't expect it to fit perfectly, the SEL did go off. used it for an 2005 chevy Astro Van, lot's of adaptations. it's leaking a little air but that is my mechanic crap work's fault."
positive,worked nicely
positive,"Perfect in every way! Size, shape, firmness, sleeping comfort & overall quality are exceptionally good!"
negative,The instructions are in Chinese only.
negative,"Shipping speed is a lie. They took nearly a week to get here, even with one day prime. Brightness is fair, easy of installation was why I kept them."
positive,fit like a charm. a little longer than originals but just a little. came with dielectric grease. good price.
positive,"Great little tool! It only took a minute or two for the driver to install, then it worked like a charm. I have used this on two different laptops with the same great results. I can point the remote at my laptop from anywhere in the classroom and it works."
positive,Battery arrived on time.  I installed it in my scooter and it works fine.
positive,second life for remote!
positive,Easy to install.  Fit well.
negative,I received only 2 pieces instead of 4
positive,Just what was needed to complete the job
positive,Seals very well
positive,Perfect fit for my Honda Accord 2005
negative,"Great in theory and will come through in a pinch but… Let’s just call it what it is-? Foldable soft sided bucket!! Translation: it is an inverted scoop shape item that can “in theory contain water!!”<br /><br />Look at my included photos… You will see how compact this can be- I consider that a perk! Especially, if needed to fit into tight space for storage. But, if you also view the photos… You’ll see, the outer brim does not like to hold it shape, at least when it’s empty of water! Where I run into trouble.. was moving the filled bucket from point A to B- I don’t recommend! This is best field where one plans to use- when lifting the handles when full.. the brim does bend and shape shift!<br /><br />Now, where I do see this coming in handy is, when transporting something that may leak liquid or, where you need impromptu ability to hold any amount of liquid (up to 3gallons -.5 for sloshing!) this can step up.<br />I see this being great for camping, a day at the beach… Or, left in a car for any of those unexpected moments. Otherwise, i’d suggest a real bucket if wanting to wash the car or, hood fish, fetch a pail of water ha ha.. things that need you will need to depend on more sturdy security!<br /><br />The price point of under $10 its spot on!! So, I don’t think anyone would be truly disappointed with what this can offer you. But, for my specific need- car wash “bucket” it’s not the ideal solution. I hope this info can help your decision.. feel free to let me know!"
positive,exactly as expected
positive,Great!
positive,Very heavy & solid rubber.  These work great.  Cheaper at Harbor Freight though.  (I paid $12 on Amazon)
positive,"The sweet summer breeze is a fruity smell that isn't giving me a headache like many other perfumes/scents do.<br /><br />I'm trying to rid a van of smoke and this has taken its place. I still smell smoke on the seats if I put my nose right up to them but otherwise I'm pretty impressed. It's only been a day though.<br /><br />Update: It's been about 3 weeks and the summer breeze scent is pretty faint and I can smell a bit of smoke coming back. The van has been outside in spring, temps ranging 60-80 degrees."
positive,"Decided to pass on the dealership's $100 charge to install this filter. Filter is  manufacturer grade, fit perfectly and was easy to change."
negative,"The description noted that this item fits a 2"" receiver hitch. It certainly can be inserted, but is too small to fit snugly. It rattles around and doesn't sit level. I am returning this item and looking for a better product."
positive,Nice
positive,"Got it for my 2004 Harley Fatboy, Quick plug in and I was back on the road.  The light is brighter than stock I had and much better protected.<br /><br />Works Great!"
positive,"The connectors are horrible, insulation slips around too much, other than that everything else is top notch"
positive,i bought this for our vehicle.  I like it a lot.  It is the right size for a vehicle and I have used it in two places - behind the passengers seat and behind the middle arm rest of the SUV.  Either place works well.  I would recommend it.
negative,I honestly expected to send to last longer. As everyone has typically indicated may be about a week.
positive,"These fit my 2011 Toyota 4Runner perfectly. They are much more rugged/beefy than I expected. These are going to be perfect for this coming winter, having a deep edge to contain the snow and mud."
negative,No sirvió para jeep Grand Cherokee 2011
positive,Need to send several different sizes the one on the door handle is a lot fatter and the ones on latch are smaller
positive,works great for repairing tile.
positive,"Simple tool, same design for years. Good price, quick shipping."
positive,Perfect for my trailer!
positive,Exactly what I expected...would order again!
positive,added more power ports to my rig for accessories.
positive,Easy to install.  Professional appearance.
positive,been a great tool thus far
positive,Looks awesome and works perfectly.
negative,It hasn't even been 24 hours and the actuators stopped working. It was a total pain to install (I have a small car) so now I have to take it ALL out to return/exchange it??<br />Don't waste your time and money; buy the more expensive kit.
negative,Average quality and cheap metal ring but the looks are pretty good.  For the price it's to be expected.  I had to take it apart to drill a hole bigger to be able to adjust the voltage reading.
positive,Fits my 2006 Craftsman T1000 perfect.
negative,"If you're putting this on an XR650L, I'd recommend a fritzco sprocket.  These are fairly good but will mount a bit offset causing excessive chain/sprocket wear.  I ran this for a while before dumping it.<br /><br />I suppose it works, in a pinch.. and it's better than the OEM thinner sprocket which will wear the countershaft excessively."
positive,Real good replacement for the earnest tray twist lock socket wracks.
