sentiment,text
positive,"After almost knocking myself out on the edge of one slideout, this product is essential to have on our motor home."
positive,Perfect for someone who drives as Indian. My friend loved it.
positive,I have been using them for years good everyday truck tire. Would recommend them.
positive,Sturdy and long enough to get my big Buick windows. Works great but hate to have to use it.
positive,I use this every time when I wash my car and it has really helped to keep my tires clean and looking awesome.
positive,Very bright and visible in even the brightest sunlight. They compare favorably to any LED warning light that I have seen. I recommend them strongly.
positive,"Used this on a my Harley Sportster custom 883, 2006. It didn't fit right out of the box. I had to make a hack to make it fit. But it fits. It takes the wind off my chest at speeds over 50MPH. It looks a bit funny because it sticks out so much. I had to drill and grind 2 small metal pieces to extend for the visors clamps to be able to reach the screw holes of the forks. If you want plug and play- it's not for your 883C but if you don't mind getting a little dirty go for it. Some people like it, some don't, I really like the look, club style."
positive,"I am impressed! This &#34;thing&#34; works exactly as it's supposed to. It took me perhaps 15 minutes to install the exhaust adapter (somewhat unusual situation, so it could take others a lot less time if all was &#34;normal&#34;), which remains in place on the generator's exhaust pipe. All the pieces fit together precisely, so that once the exhaust adapter is installed, it takes maybe 5 minutes to install the whole thing--and it works! It quiets the generator a little, but most important, it diverts the generator exhaust about 10' above the normal exhaust pipe outlet. The recommended test, of seeing if a small piece of paper will travel upwards inside it, worked exactly as predicted--perfectly.<br /><br />Some comments:<br />&#62;The curved steel part that is attached to the exhaust adapter gets really hot. Keep pets and children away! Not sure how, but I'm thinking some sort of protective shield might be a good idea. It stays hot, well after the generator has been shut down, so no one should get anxious to demount the system too quickly. I didn't time it, but I'd guess it was a good 5 minutes before I could leave my fingers on it.<br />&#62; The plastic piping never gets too hot to touch. My first test run was for about 15 minutes with the generator running and the RV's air conditioner loading it. The ambient temperature during the test was about 95 degrees. Yet I could touch the plastic pipe anywhere that I chose to.<br />&#62;I can't imagine making one as inexpensively as this one costs, while still trusting it to do the job. I'm a DIY person, so I priced pipe and pieces some time ago, and if my time is worth more than 25 cents/hour, I couldn't duplicate as good a one for the money."
negative,"Cheap aluminum,  punched out. Rattles in the housing. Box broken during shipping due to being packed in with two heavy items."
positive,Awesome color accent for my jeep.
positive,The missing link! This cleared my CEL on my 97 4runner after replacing the O2 sensors and the TPS.
negative,"Not my first rodeo. Out of the packaging it looks promising. Reality is that it’s sorely lacking. Obviously not leather and that’s ok, but it’s not a good facsimile. It stretches a bit but ends up looking as cheap as it is. Stitching is weak, broke with minimal tension. The included thread is laughably thick. Doesn’t need to be to be strong, but this stuff tangles not matter how careful you are. Have never seen thread work so hard to unravel.<br /><br />You can do better. Easily."
positive,"Didn’t use velcro or sticky tape, stays in place in my 2019 Toyota Tacoma 4-door. A bit of a tight fit, which probably why it doesn’t fall. Used mostly for face masks, so they stay clean and not mixed up with everything else in the truck."
positive,Great value! Very durable and awesome fit!
positive,Item as described
positive,Perfect replacement.
negative,"Due to its high viscosity, it seems to attract more dirt than keep the tires clean over time.  I would much prefer the spray can version.  One trial was enough.  Trashed it at about halfway through."
negative,"Im a contractor by trade. Love my tools...especially good ones. The handle on this is not that big. Im 5ft4inches tall and well my hands aint that big ya know? My hand dwarfs the handle on this tool. I suppose if leverage is not what you need from the handle end of this tool, it should be fine.<br />Otherwise it looks and feels like &#34;made in China cheap&#34;. That being said, its sharp and has an intricate bend to the tip. Looks good for the purpose intended. Think its worth about what I paid for it."
positive,This is my second Park tool patch kit.  Once I realized how dead simple it is to repair flats on my bike I haven't had took buy another tube.  Never had a bad patch with this kit..
positive,For that extra torque some connections need.
positive,I love all towels from them
positive,Basic
positive,Was easy to install and worked well
positive,Good 10w40 oil for wet clutch applications. Keep up with regular maintenance and this oil will do just fine.
positive,"Super easy to install, drop in.  Really nice to have ur small items organized and easy to reach.  Highly recommend getting one."
positive,used to repair engine oil filter line on skidsteer exactfit and did not have to buy fifty feet!
positive,It fits fine and I guess it will work fine.. Just prepare to be underwhelmed by this injection molded piece of plastic.
positive,Really the only one that you can actually feel makes a difference
positive,Works great! Fit on 2006  Nissan Xterra.
positive,"Even though I followed the guidelines for the correct battery, the battery was too small. Once installed and started, the battery started right up. I will see how good it is after not driving my car in this snow storm for two weeks."
positive,Exactly what I wanted...and you get two!
positive,I bought these to replace the cheap ones that came with my JD 1025r. These are much better. They really fit tight and snug. This was a good purchase. Shipping was quick too.
positive,"I tried this in order to carry my air  machine for tire inflation.  I didn't want to store in card box.  This is so nice; better than I expected.  It holds my machine, safely, and the extra parts and has a little space left for other small items. Inside the carrier is a mesh insert bag in top that holds instructions and other papers.  I like the black exterior with the yellow accents to make it stand out.  So little room needed in trunk. I would recommend without receiving compensation."
positive,"I buy these quite often as I get a lot of flats on my roadie due to glass.  The patches are easy to place, and they don't come off once they are glued.  The glue does sometimes stick to my tire, but it pulls from the tires pretty easily."
positive,"Pissed off at GM since I bought a $64,000 truck and this was not included.<br /><br />BUT it is a welcome addition!!"
positive,Fit perfectly
positive,"This shackle has the breaking strength of 38,000 lbs.  This is amazing considering its light weight and softness.  If you need to do an emergency tow and not scratch your vehicle this shackle comes with a nice sleeve for protection.  Its synthetic fibers offer high strength to low weight and flexibility.  All of this make it easy to stow away in the vehicle or in your carry bag for emergencies.  The flexibility allows it to attach to a variety of fittings."
positive,"This sticker is a little smaller than I was expecting, because I didn't figure it out before I ordered it, but I think it's funny.  i'm kind of bossy at work, so helps make my case and give folks a heads up!"
positive,"They come in Ford / Motorcraft packaging. The CPS is black with purple o-ring. I think this is the one considered the best replacement for a faulty CPS on the 7.3L Powerstroke. The picture on the product page looks different (much lighter), likely due to camera lighting. Haven't installed it yet, but if there are any issues, I will certainly update my review.  01/11/2023"
positive,"I love that its not bulky and easy to operate. I had mine for couple years and used it a lot!!! One day grandkid came over in his car and I saw that his tire had low air pressure and ask if he saw that. Of course he didn't see it or have anything in his trunk to help with this or any road hazard. For Christmas gift, I purchased 2 for grandkids to put in their car.<br /><br />My friend saw what I had, he asked me ordered him one.  After it saved him out in the woods, he ordered 3 more for his kids and friend."
negative,"Bought the 62inch shelf for a new Nissan/Chevy City Express. The shelf is advertised as it fits this vehicle. It doesn't!!<br />Had to cut all the shelving down to size and re assemble. If you do this, make sure you cut opposite side of rails so you end up with a left and right. Otherwise you wont be able to use the metal dividers. The other issue I had was they shelving does not sit against the back of the van. So there is around 3 inches behind the shelf that is un usable. In a small van this reduces the width between shelves 6 inches total. Thats a huge waste of space!! Other than the shelves not fitting correctly and the wasted space, they are very well built. The brackets used the fasten them inside the van had to be modified. But they are adequate.The last picture shows the shelf installed after being cut down.  I dont think I would buy these again based on the fact that they dont fit very well. I think the countoured aluminum shelving would have been a better choice for these small vans."
negative,So disappointed that this came used. I was about to use this in the dark and I could still see the dirt and grime trapped in the vacuum. So gross. Will be returning ASAP.
positive,Perfect for our needs!
positive,"I received my Curt Manufacturing hitch cover today and was pleased that it was very fast shipping. I printed and placed a III% decal on the cover for my own personal touch. But when I tried to put it on my hitch, I ran into a problem. The bend on both ends of the actual cover prevented it from sliding all the way in and the holes would not align for my hitch pin. I'll have to enlarge the holes to make it fit. Other than that, it was exactly what I was expecting for a plastic hitch cover."
positive,Nice addition to my bike. I needed a good bottle holder. Sturdy and very easy to install.
positive,Perfect!!!!
positive,Have used the inverter several times now. Works great. It is very quiet. I would recommend this to anyone needing an inverter.
positive,This is OEM!
positive,Good plug at a good price with fast shipping. Nothing more to say!
positive,You want this for emergencies!<br /><br />Everyone should have one of these in the car.  You never know when a light gets left on in your car and ruins your battery.<br /><br />It’s a good idea to keep this to give you a quick boost and get your car running again. This is really good when you need it !
negative,"save time and money buy the dealer ones made my car worse, ar the end of the day lost time and money amazon returned my money but had to pay a mechanic twice"
negative,"Please don't do it.. that's it, that's all"
negative,This is a terrible design....Lucky if you can get it opened without a knife...<br /><br />That alone makes it terrible product as frustration. I still have the one pack as you literally need a knife to open the container.
positive,👍🏻
negative,Did not fit the vehicle it specifically said it would fit in.
positive,we love them
positive,"CarGuys did NOT ask me to write this review.<br /><br />Before I start, I'm an avid car enthusiast.  On the paint care side of things, I have tried just about every product under the sun.  I have my fair share of sealant, waxes and ceramic coatings.<br /><br />The packaging consists of the sealant bottle, one foam applicator pad and a super high quality, plush, seamless, one-sided microfiber towel.<br /><br />This product, by far, is the easiest to apply and buff off.  It goes on extremely easy.  Waited 30 minutes per the directions, and buffed off with the included towel.  I then followed up with the Car Guys Hybrid Wax.<br /><br />The results are simply amazing when considering the amount of effort and time put into the entire operation.<br /><br />I will update after a few months to advise of product longevity.  I do not run my car through an automatic carwash as they are simply terrible for your paint and also the protection that is applied.<br /><br />Great job, Car Guys.  So far this product is a knock out of the park."
positive,My ac is new again
positive,"I was looking for a yellow colored recovery ring for my yellow Rubicon and found this item. It arrived quickly and is a very sturdy piece with a lot of heft to it. The paint protection plastic is actually bright red but once I got some mud on it, it looks like it's not. Overall very happy with this product and would recommend it."
positive,"It was helpful to read the reviews, after seeing many that installed the back ones wrong , I made sure not to make the same mistake. People, read instructions....lol<br /><br />They fit great on my 2015 jeep"
positive,"Didn't believe the online claim that it would custom fit my 2018 Ford Transit 22' van with tall roof, but it fits perfectly.  Offers excellent protection and heat reduction."
positive,Once again I am pleased with this product bought from meguiars !<br /><br />This makes product number 4 that I have bought and they are all great.<br /><br />Makes cleaning my Audi a great pleasure and the finish is showroom quality when I am done !
positive,"Overall an excellent plastic razor blade. My wife uses these for her nail art and they preform well.<br /><br />Now, the changes: Orange blades instead of blue. Not sure if they're different compositions, but they work.<br /><br />No longer Made in the USA, now made in China."
positive,So far so good seems to be working fine.
positive,"This is so easy to use.  I have a 2014 A-Liner, simply remove the drain plugs under the unit, screw this to the water-in connection and connect the compressor hose.  So easy to do that I will not hesitate to camp in the cold weather knowing that I have to do this every time I come home."
positive,This does fit the 2018 sportsman 570. I have it on mine. You just have to adjust the drop leg. My Atv store told me it wouldn't work. It bolts right up. I have used it for two winters now. Its much stronger and better built than the smaller one. With the drop leg it makes it much easier to hook up and unhook.
negative,Good
positive,This is a good heavy strap should not brake for a long time like the cheep one did. Just wish it would come in a 10ft one just as well very nice strap.
positive,Thank you it's perfect
positive,"Last winter was terrible here in N.J., so in preparation, got this blanket for my son's car.  A psychologist, he is part of a mobile crisis operation and often has to journey out in the cold at all different hours.  He says the blanket works faster than his car's remote start to keep his still too skinny legs nice and warm.  Fits nicely in it's storage sack too.  Great buy."
positive,I use this for harley big twin engines and it works well to loosen filter
positive,"30yrs ASE certified mechanic.<br />I bought my 2010 Tundra  used to replace my  2007 Tundra that was totaled out. The 2010 Tundra came with a K&N ""cold"" air cleaner already installed. FYI the K&N is not a true cold air kit because it is not sealed from the engine bay and  it pulls air (hot air) from the engine compartment vs cold air via the fender well like the factory.<br />I included pictures so you can see the quality and design difference between the K&N vs the S&B CAI kit. Filter housing is a true cold air set up for the S&B. Intake tube is much larger for the S&B vs the K&N and well as the air filter.  IMO you can not buy a better CAI kit for a factory motor set up in your vehicle than the S&B kit."
positive,Works
positive,Nice
positive,"The dreaded tire pressure warning light came on. Three gas stations later, I couldn't find one with a working air machine. So...after a ton of research I bought the Black & Decker ASI300 inflator.<br />After checking the pressure in all four tires, I found that one was low 15 PSI, while the others were about 7-8 PSI low. That's what I get for loaning my car to my kid when she was visiting from out of state.<br />ANYWAY, it took me less than 10 minutes to inflate all 4 tires to the correct pressure. You set the dial to the desired tire pressure, connect to the valve stem, turn it on and wait a couple minutes. Machine stops automatically when correct pressure is reached. After I inflated 4 tires, I turned on the ignition and the dreaded light was still on! Then I remembered reading about the spare tire on the back of my SUV causing the warning light to come on. So I topped off the spare which was about 10 PSI low. This time the dreaded warning did not light!<br />As an added bonus, it operates on AC or via the cig lighter outlet in your auto.<br />For the convenience and safety of being able to inflate everything from basketballs to tires at home or on the road, I'm giving this 5 stars."
positive,Fit my Momo race seat and my 2016 Nissan GTR perfectly.
positive,Replaced the cap on 2004 kia Optima.  Fit and worked.
positive,car washing
positive,It really does fir perfectly in my LEXUS.. I would recommend this product
positive,fits well between our sports seat and center console. Useful for holding cell phone or iPad.
negative,"These floor liners are NO WHERE NEAR as good as they used to be. This is my 3rd set purchased in about 10 years. The others were GREAT but these are cheaply made, and don't fit ! For $200 these are HORRIBLE!!!! I WILL NEVER BUY IT RECOMMEND AGAIN."
positive,Perfect fit!
positive,STARRY NITE.  So cute. Easy to attach.
positive,fast shipping excellent price
positive,"Husband ordered the filter for his side by side.  He's happy, it was a repeat order!"
positive,Popped right in...perfect!!
positive,"Had to remove rear tires and drill to install, but worked out very well!"
positive,"I have a 2006 Hyundai Sonata, and the Jumbo car windshield sunshade fits beautifully. I have used the twist-fold circular sunshades previously, so I had no trouble folding it back into a circle for storage. I am so pleased with this product and am glad I purchased it. I have only had the sunshade for 2 days, so I cannot speak to how it will hold up. If anything happens to affect my opinion of the product, I will update my review."
positive,These are Great and look Great on my truck
positive,"This genuine sheepskin car seat cover is beautiful and superb quality. I am actually using it to cover my office chair so I can't comment on the fit for a car, however I have had these covers in the past and this one is made very well. The main areas of the back, seat and front of the headrest are sheepskin (which is foam backed) while all sides, the back of the seat cover and the back of headrest are faux fur (see last photo where the top of the seam is the faux fur and the bottom is genuine sheepskin). The headrest being a separate piece is also a great selling point. The skin is super soft and a somewhat short length with a buttery color. It is very comfortable and I highly recommend it."
positive,"Works flawlessly and for the price I don't know how you can beat it.  Maintenance isn't sexy, but it's necessary."
positive,Work and fit great!
positive,Easy to install and will hold the license plate securely. Did not need the new screws and caps and I used the old ones.
positive,"My mechanic told me my car's wheel bearing needed to be replaced. And so I went into Amazon and looked for one that fit my car but also had great reviews. That ended with this one. When I brought it to my mechanic, he told me Timken was a good brand. Great!"
positive,Quality product.  Correct sizes for my  2003 Saturn Vue.
positive,It's a cycle battery... it's as I expected. We'll see how long it lasts. Easy to perform the initial electrolyte fill up. So far so good!
positive,Parts looked just like the description.
positive,Hey for the price you can’t beat it. Especially if it’s to get you by.
negative,"This is the real thing ,you might want to remove the part because it’s hard to get of<br />UPDATE IT LOOKS TERRIBLE WHEN THE LIGHTS ARE ON!"
positive,So far this is the best trickler I have found
positive,"Bought this filter for my Town & Country, and it was a perfect fit. These Fram filters are solid - you aren't going to have any dust or dirt get in the air intake. So it does the job!"
positive,"Difficult to accurately state this product worked as I wanted (uneven idle), for it was preceded by another product--however, the idle improved so I rate this as excellent."
positive,"Added this to my Milwaukee M12 inflator... ""Super mod"""
positive,Fit perfectly
positive,Good match. It's difficult to get the paint smooth so it blends in but I found a little polishing compound helps blend the area where the old and new paint meet. I may try some of the clear coat to see it that helps even more.
positive,My mechanic had this installed in 5 minutes and no problems with oil leaking since...I still hate this Saab though. Grrrrr
positive,"Good Item, Fast Shipping"
positive,"Functionally, it does its job (fills tires).  However, the filler tube is way too short (I bought an extension).  The 12V and 120V cables are poorly stored. On the positive side, it runs very cool."
positive,Look great fit fine
positive,Good product!👍
positive,good replacement for trailer lights
positive,"These just barely work in the windshield of our 2012 Volt, but they DO work, if you put the visors down to hold them up.  I use them sideways because the windshield is more deep than wide.  I put the elastic loop attached to one of these over one visor, which holds it up more securely, then the other one leans against the first, which also helps to hold them up.  If BOTH of them had an elastic loop to put over the visor, that would be great in my humble opinion.  When you twist them together to fold up, they do their wiggly best to &#34;escape&#34; out again, so I just fold as well as I can in a few moments, wrap the elastic loop over the lot, and toss into the back seat.  They do the job, which is the important thing."
positive,Works
negative,Software did not work... no idea if the cable does
positive,"I have a brand new convertible top on my car, so I used this on it since it said Lint free, it left lint on my black top.  It’s very hard to get lint off it once it gets on it, even with a brush. But I have yet to find a mitt that doesn’t leave lint.  The mitt fits snuggly on my wrists, and they are small, so that was good, but water somehow still got into the mitt, which I don’t care about.  So it functioned as a regular mitt, nothing special for me."
positive,Very easy to install and look’s great.
positive,"Work well, the inside of boot can get torn..."
positive,These are clever window clings that block glare in car windows. They work great for that! If only they were easier to fold back up!
positive,"Worked perfectly, will never go back to the aftermarket wipers after using these. Took around 5 minutes to install and they work great."
negative,Terrible adhesion to the door- I feel it slip every time I pull the door closed. Not great quality- can definitely tell they’re aftermarket. I think you get what you pay for but the product leaves a lot to be desired.
positive,"This scrapper is really nice and arrived really quickly. It came disassembled, but only took me a moment or two to put together. It's strong and has done an excellent job so far. I live in Northern Wisconsin, and we have snow October - May! A good snow scrapper is essential and I am happy to have found this one. I buy from this company again, so I would have to recommend it.<br />Hope this review was helpful."
negative,Broken when they arrived.
negative,Yeah it does the job<br />Ends look like something i can machine better<br />Locking device for better words jenky
positive,Durable
positive,Clock looks great on the dash of my 1985 Corvette.  Only issue I have with it is that it doesn't have an internal light so it can be viewed during the night.
positive,Nice sticker
positive,Works perfectly
positive,Great product
positive,I needed this for a garden trailer.  Good Finnish nice quality.
positive,Easy to use and install.  Secures spare like advertised.  Definitely recommend this product.
positive,good people
positive,This is very sturdy and I trust it to keep my phone safe as it holds it in snugly. Only complaint is that when biking and hitting bumps it doesn't always stay in the position I want it to. It's difficult to tighten that knob enough to keep it from moving.
positive,Easy to install and fit my little 1.8T golf.  Supported a rack and two mountain bikes without any issues.
positive,Great product
positive,Easy to install
positive,Great product. It fit well and was easy to apply. It protects my paint from stone chips. My only change would be that I wish it didn't have a logo on the far right.
positive,"Decent mirrors.  They fit well after a bit of rotation to align them correctly.  I have experienced some vibration, but not excessive.  Decent product for a good price."
negative,Not US made so doesn’t really work properly with modified
