sentiment,text
positive,Super basic but they’re super absorbing and super soft :)
positive,"I'm 5ft tall so seeing the complete rear of my car is hard, but with thi mirror my view if rear window and blind spots are no more."
positive,works surprisingly well on 45 year old tires
positive,Great
positive,I love this plate frame!  It looks so classy on my truck!  It's sturdy and the colors are beautiful!
positive,"I worked perfectly on my 1999 Hyundai Elantra GLS.  Very straight forward replacement, just make sure you have your breaker bar or some type of lever ready for taking off the old one."
positive,"Husband loves them, they are a little small"
positive,"Sizing was perfect, easy to use, easy to store, and does the trick."
positive,thank you
negative,They are not working well.
positive,Better than advertised
positive,"We use this filter after our soft water filter and boy does it make the water clear & tasteless! This like most filters need to have all the O-rings lubricated with a food safe lube. Otherwise, you will get leaks and become frustrated. Awesome deal and filter, definitely recommended!"
negative,This seems to work ok but the first one broke when I pushed it into the fuel line.  It feels very flimsy and I wouldn’t order this again.
positive,Great for my sponsor children's scrapbooks (each get their own flag stickers for their countries).  Just what i wanted.  Well made- not skimpy.
negative,Cheap !! Junk !!
negative,"aint installed it yet, I will see"
positive,Works for those gym cloths
positive,These type of scrapers are very good to clear ice on the glass. Plastic scrapers tend to pit when you scrape ice.
positive,"The blower level 1 didn't work, only 2, 3 and 4 would blow air through the vents. But with this replacement it fixed the problem. Now I don' have to run it at 2 all the time which sometimes gets too cold and I have to turn it off and on again after it starts to warm up."
positive,"Good new car smell, but smell does not hang around a long time"
positive,so easy to install
positive,"I live in Florida so it is always hot and rainy in the summer. Anytime I opened the window during the rain, it would stream water directly into the handle, door pocket and my left leg.<br /><br />I have these for my Acura TL also, and love them.<br /><br />IF YOU READ THE INSTRUCTIONS CORRECTLY, you have no issues with &#34;grabbing&#34; or &#34;ruining windows\motor&#34;.<br /><br />The correct installation shows that near the side mirror, it is to be placed OUTSIDE the channel, not INSIDE. If you put it INSIDE (and I did at first), it will cause the window to grab, and the window motor is trying to wedge the window and the deflector in the small space. If you place the LIP OUTSIDE, it works like a champ. It tells you in the install sheet, but you have to look closely."
negative,Sold the truck before I had a chance to restore.
positive,"These are so much nicer than I was expecting! The fabric is nice and thick and very heavy duty! They wipe off easily and don't absorb messes. The ties that hold them onto the seat are very nice and I really like that the bottom tie is stretchy and not an adjustable strap with the plastic piece and a bunch of leftover strap to figure out what to do with. It is easy to pull it down and tuck it into the crease of the seat so you dont even know its there. Plus it helps to keep the bottom of the mat pulled down on the back of the seat. The top strap is just long enough to go around the headrest really well without a bunch of leftover strap (the top one is not stretchy).<br /><br />I put one mat in my husbands truck (A Dodge Ram) and one mat in my car ( A Scion Xb) and it fit both perfectly. I used it in the Dodge to cover the seat in front of my forward facing sons seat, and I used it in the Scion to cover the seat at the foot of my daughters rear facing seat (I just tucked it in at the bottom without trying to wrap the strap all the way around the seat - works just fine since the mat is somewhat slick so she cant get a foot hold on it enough to pull the bottom of it up). It works great for both instances!<br /><br />I am extremely pleased that I was able to receive this product for free in exchange for my completely truthful and impartial review. Even if I did have to pay for these, they are WELL worth the asking price to save your seats anymore unnecessary wear and tear. I HIGHLY recommend them!"
negative,My father is complaining it is missing the cover and that it will fly off during a rainstorm and scratch at the window. So no I'm not happy
negative,"I was tightening one of the four straps and it ripped off. I just passed the 1 month return/replace window. I like everything about this product, it lasted a few drives, but then a strap ripped off. I would really appreciate a second chance trying this item, if you could replace it. Thank you"
positive,These replaced my old wore out ones great
positive,"What a great idea!  My pocketbook is always on the front passenger seat and when I stop short or turn, it falls and the contents go everywhere.  When I use this holder, I know where my bag is and the contents stay  where they belong!"
negative,"I found the ""made to exacting tolerances for proper performance"" claim not quite accurate.  I needed a 31 tooth gear. This part had a 33 tooth gear. A precision gear shaft made to exact replacement tolerances should have made the old and new sensor gear shaft interchangeable. The shaft diameters were not the same and therefore not interchangeable. So, unfortunately, I could not use the new unit with the old gear and shaft, and had to return it.  I also noticed some sloppiness in the new gear shaft fitment as compared to the used unit I needed to replace."
positive,The Rotors are very good and fit Perfectly and been driving with No Issues Brakes are smooth
positive,"I bought this and the Meguiar's one at the same time to try out two major competitors.  This one was super soft and kept soaking up water.  I was able to dry my wife's Cherokee without ringing out the towel.  The Meguiar's one I had to ring out 3 times for my Charger and felt scratchy.  I will see how this holds up over time.  So far, I like this one better and I am thinking about order another one or two.  My one complaint is that the tag is a little scratchy feeling and has to be folded out of the way."
negative,"This item is sturdy and the lock is secure.  But you must be sure that you have enough room for it on your vehicle.<br /><br />I ordered this intending to use it as a hitch lock on our motorhome...but it is so long, there is no room to use it.  It hits the body on both sides, due to the length, so it cannot be inserted from either side.  While the lock end needs to be lengthy, the other side did not need to be so big and that is where the problem was.  Maybe our hitch is not the same as some other motorhomes.<br /><br />I showed it to my husband and he tried to put it on our Jeep, but he ran into a similar problem.  The Jeep flat-4 electrical connector is mounted on one side of the hitch and it prevented him from pushing it in from that side, and if he slid it in from the other side, then there was no room for the lock end.<br /><br />It is designed for both 2"" and 2-1/2"" hitches, but the problem is that both ends are just too long.  If you have plenty of room, it would be a good lock.  We simply did not have enough room on our vehicles.  See pictures for the length.<br /><br />I gave it 3 stars because it does seem to be a very sturdy lock, just not for our vehicles."
positive,"Exactly what was needed for the deeper Zipp rims.  Removable valve core tubes and these extenders make everything so much easier.  I wish you could buy different lengths in a set, but this was a huge improvement.  48mm valves on the tubes and 60mm extensions fit the 808 rear wheel well but are long on the 404 front wheel."
positive,Great product
positive,They aren't super bright. But they replaced almost all the lights in my truck on a 2016 Colorado. And they seem brighter than the factory
positive,"Bought this to replace my OE equipment  and so far so good, seems to be as good as the Original"
positive,This item was missing from our 08 Tahoe and this fit perfectly.
positive,"Despite looking like nothing near what my old, broken, door switch looked like, it works just like the old one. Just a note, these are NOT that easy to replace if you have lost the wires within the car's metal interior."
negative,It’s new but not good
positive,Looks great and has maintained it color and quality through multiple car washes.
negative,"And the locking mechanism doesn't work, have to order OEM instead. Totally regret this purchase. Even the red stickers on the lock toggle is gummy and not even placed right. Save your money and GET OEM parts!!"
positive,Works great.
positive,Good value
positive,Great products.  This is a great kit for everything for your auto needs
positive,Fit perfectly
negative,"I bought this thinking that it would help me to do a brake job easier, product looks great, the idea is spot on, the problem is that mine didn’t hold a vacuum . I readjusted hides, fittings etc, and it doesn’t hold. Maybe I should have bought a more expensive version. Maybe it was just the 1 out of 100 that’s defective."
positive,Cartridge type*. Comes with 2 O rings one for the plug and one for the filter.
negative,"I know this is the genuine Toyota WS fluid for my Lexus RX400h CVT and rear motor/differential, but it just does not last long.  The WS fluid turns from cherry red to brown in the CVT and faded pink in the rear motor/diff in just 30K miles.  I expect better performance for a fluid this expensive.  The owner manual calls for just a visual check at 60K, or change at 60K if towing is involved.  I'd change it at every 30K.  Not impressed."
negative,"This stuff is so bad.<br />If you like streaks and spots, this is the washer fluid for you.<br />Terrible."
positive,Very easy to put up and take down. Fast delivery.
negative,"Be careful when installing.  Tail gates have cable supports that interfere with suggested mounting location.  This unit is minimal quality steel for support.  Any guys over 225lbs, should consider another make of access ladder. I find this unit minimal at best. Must also be on perfectly level ground when using or ladder twist considerably."
positive,Perfect fit and way better than the thin steel gasket that Nissan OEM supplied
negative,"Smell was great, but only lasted for two weeks. I was really anticipating it lasting longer. Kind of bummed."
negative,We had snow while I was out of town and the car was at the airport. As I was scraping the windshield the wiper arm broke away from the blade. The blade was embedded in the ice. Add you own invective.....
positive,Came packaged safely and on time.
negative,Product showed as ordered but did not work with the genie garage door opener.  Unfortunate actually because the size is perfect.
negative,I have change my review for this product. The color changed after only a couple months of use
positive,Bolted right on and only needed minor adjustments to properly tune in. Will buy again if needed
negative,truck stumbles when started up some times now - didn't do that before these were put on
positive,"Very nice fit on my 2003 gmc envoy sle.<br />Looks nice, no complaints yet will update if needed.<br />I noticed a slight pad dragging sound during the test drive, so I checked the inside of the old rotor and found that the parking brake pads had been dragging a little on the old rotor which was evident by the shiny smooth surface where the shoe was. Hopefully these stop otherwise I get to go back in and take the diff apart to get the axle out to replace the parking brake backing plate, which was almost completely gone. Thanks gmc, you made a 5 minute job into a 3 or more hour job. Brilliant."
positive,"Update:  Love it. Only need one band to secure. Nav, heart apps, music. :o)<br />*******************<br />Stays put  on the road. Don't know how it would be for off-road. Value for price. Confident it will hold my phone.  Does everything it's supposed to do. Does not cover headphone jack."
positive,They work well but are longer than they really say they are. Wanted to have them closer to the size they claimed. After measuring a tight measurement on my hitch but these are longer than they claimed and stick out more than I wanted. They do the job though.
negative,Item did not power on when connected to a verified power source.
negative,"When this is manufactured correctly it’s a very nice mirror. That said, I had to return two because the mechanism to swing the mirror about the bar was dysfunctional. It operates on two steel balls on springs and this part likely the depth of the holes the springs are in is not well quality controlled because two on them wouldn’t move if with loosing the screw. Then if it does come apart it is quite painful to put back together. Not a fan of this mechanism, especially in a mirror that is tremendously more expensive than others."
positive,"This AC adapter is more than what I needed, because of its choice of 7 voltages, which may be very useful to me in the future. I needed only one, and expected to pay for one, what I paid for the 7. Very good."
negative,Not a high quality product made by GM.  I am very disappointed with this product
positive,"Excellent kit. It is beautifully made, solid brass. The magnet (that gets a slight mention in the product description) locks this down so tight that I would bet it could survive a hurricane - stuck like glue to the side of an air conditioner.<br /><br />Ultimately, there is not much you can say about this - easy to connect, easy to clean and easy to use. Weighty - compared to lesser models, but that is testament to its quality.<br />The cap on the side which is equally well made (unscrewing and screwing it back - it tightens in the thread towards the end, cannot be (easily) over tightened, and its clear when its sealed) is held in place when removed by a handy rubber line.<br /><br />Costs more than many, but quality tools last forever! This is a solid investment"
positive,"seems to be working, ended up having to replace my water pump so I don't know if I really needed it."
negative,Not enough product on the sponge and it really didn't do much for my car.
positive,These worked and were at a good price
positive,Great Product!
positive,Fit and works as expected.
positive,Works great for my 1999 F150 5.4L. This can solve the common lean condition code besides a dirty mass airflow sensor which can throw the same code on my truck.
positive,Smells good but did not work well on stains. Definitely will not purchase this again as other products I have used worked better.
positive,Good product as advertised
positive,I love these mats. They have cut down on the amount of dirt and water transferred from my kids shoes to the backs of my seats. It has spared my leather seats from normal wear and tear. these were easy to install both for my rear facing daughter and my forward facing son in the van. I should have purchased these a long time ago.
positive,Took a little time to line up the holes.  Fits nicely on a 19 year old S10.
positive,Very nice and sturdy key holder looks just like the pic
positive,works good
positive,"This is a high quality coolant. It works as described for my car and it’s easy to use. It’s a very straightforward product, but it’s reassuring to know that it works as anticipated. Five stars."
positive,Only used one time and so far they work really well easy installation and wipe clean leaving no streaks.
positive,They work!! I had to insert abd remove 12 times not 6
positive,"Used three, worked, will change my mind if they go, but the price beats one at my local hardware store so 1:6..six wins."
positive,Excellent
positive,I mounted these on all sides of my tractor and was amazed how much light they produce. they don't get knocked of like other lights I have used
positive,Great!
positive,"I have an existing Klein direct drive air horn, but the tone was much higher then I wanted. The longer trumpet gives a nice deep sound. It’s not all that much louder then the factory horn on a superduty truck, but if you need a air horn it’s a great inexpensive choice."
positive,Great replacement parts
negative,"I have yet been unable to install. I have asked for help on why the side bolts don't fit and I haven't received a straight answer. Upon looking at previous comments/reviews, I read someone used an M12 Thread wrench. I went ahead and bought that and tried it, it went in the car's hole, but the bolts provided are still not going in. My husband already went to Ace Hardware and got more bolts and those didn't work either. This has resulted in multiple arguments on about different possibilities as to why this is not fitting. Now I am considering purchasing more bolts, which would be the third set of bolts we purchase for this. Now, if they had sent the correct bolts in the beginning, we wouldn't be having this conversation.<br /><br />I see other buyers have had a problem with the bolts as well. Had I paid attention to them, I would have not purchased this hitch. It's too expensive to return and now I am stuck trying to either resell this hitch, keep purchasing bolts, or just seriously put it in the trash. The headache this has caused is nauseating.<br /><br />So far, I have spent multiple trips to the hardware store to buy different sets of bolts, the thread wrench, and much time trying to get this installed. Factor all that in, it would have been more cost effective, less stressful, and less time consuming had I just gone to Uhaul. Ugh."
positive,"So far I really like this car cover. My new car was getting covered with tree sap from the sick tree next to the neighbor's driveway, and this takes care of that issue completely. When I ordered it, I took the advice of another reviewer and purchased one size larger than what the seller recommended for my car and that has worked out perfectly. I'm glad I did that. I live near a large body of water so the wind is pretty much a daily challenge, but this car cover has elastic all the way around the bottom so it stays put no matter how high the wind blows; I don't even have to use the straps to anchor it to the car it works so good. My only issue with the car cover is the same as with any car cover, it is a five minute painful process of running back and forth around the car to get it rolled/unrolled. If someone has a good technique for doing that quickly, I'd love to hear about it! I did not receive any compensation or discount for my review, I just wanted to let folks know that this car cover is well made and well worth the price!"
positive,Audi A4 protected from day 1 -- carpet still like new. Easy to remove and scrub outside of car. No worries about muddy or snow-packed shoes or boots ruining your car.
positive,now I charge my car with this everyday and take only f couple of hours to make it full
positive,"Looks cool but has a much higher profile above my head than I was hoping so it looks a bit more dopey than cool...  I thought oils ride closer to my he'd on top...  That being said, it is DOT, and the leather look is very cool.  I just need to find a center spike now to draw away from the height...  Overall decent helmet."
positive,"This was a perfect replacement on my 2014 Tacoma.  Took about 10 minutes with a Torx T30 bit in my drill and a 10mm socket.  I have the backup camera and it installed flawlessly.  I didn't have to bend or turn or switch anything around, it was a direct replacement for the stock tailgate handle/lever.  So this may be a new improved version.  Love how the BOLT technology codes your key to the lock on the first turn of the lock!"
positive,"Have not installed it yet, but if it doesn't leak, it will be great! Great price & really fast delivery"
positive,Fit my Pilot and works great.
positive,Works perfectly. Lawnmower starts faster now
positive,"Convert a ball is best produce going and the service from manufacturer is unsurpassed. Have several shafts and move them around, theses covers will keep them clean"
positive,"For the cost you absolutely can’t go wrong.  Who would have guessed a stylish trash can would exist?  lol.  Seriously, it’s very functional, large enough for a normal use, and the strap/mounting has different options depending on your use.  It’s actually very well built.  This was a a very good purchase and a surprise given the price.  I work out of my vehicle all day.  I don’t put half full sodas in it and can’t say it’s completely waterproof, but I’m sure it is.  The insert is something like in a cooler.  You can’t go wrong with this.  This is one if the Best Buy’s I’ve had on Amazon in a while."
positive,Exactly what I needed. Fast delivery.
positive,The only issue I had is I think it’s a bit pricey. Otherwise it’s sturdy and great looking. Just perfect!
positive,"well done, smooth cuts, easy to put on, came out looking great on my car and would buy others."
positive,"Works fine, cheaper than buying at the truck stop."
positive,I had to change it in a one year
negative,"You must really want to put these on if Lippert did not install mounting plates at the factory. This is not a project for a novice mechanic. Ordered two at the same time. Both were missing parts and both had the wrong parts. Instructions can be found online with a simple search. . A few $100 bucks to get a welder to fabricate top mounting plates to offset from H bean and slideout roll bar. Also, you will have to cut out a piece of the bottom plate if you have Trailer SumoSprings installed."
positive,Nice scent
positive,Handy tool
negative,"This alternator fit perfectly, it's still working fine. BUT the price dropped over $5 just after I bought it. Why don't I get a refund??"
positive,Worked Great foe me. Used these to keep mud and snow off the running boards on my truck.
positive,works easy on cab over tie down
negative,Power steering pump arrived without nuts and bolts. When we had it placed in an automobile it did not work. It was returned
positive,"So pretty, fit perfectly and was easy to put on.  My car is a 2017.5 Murado."
negative,"As the item description states, “this will fit your 2018 fusion”. No, it does not. Not only is the backseat floor mat not long enough to fit, but the center part is too wide. Doesn’t come close to laying flat or covering the floor."
positive,This works great.
negative,"They are not great, water leaks out, the gatorade bottles with the automatic stopper are a lot better of a product, one of the stoppers came out of the bottle as well. Not great, would not order again. Again, they leak and the automatic stoppers are better."
positive,"Unlike many other brands, this one is big enough to put on."
positive,This bike net holder works really well.  It expands but is not going to loosen up like most nets do after awhile.  This one is very sturdy and does a good job of holding things on my bike rack. Good deal for the product.
positive,"I haven't used it, but the size, heft and appearance of the can inspires confidence.  I switched from run flats to non run flat tires on my car and I have no way to carry a spare.  I bought this, another brand of a similar product, a set of tire plugs, an air compressor and a scissor jack - all of which I keep in my trunk.  If I were to have a puncture, this can is the first thing I would try, should I find myself inconveniently far away from the promise of roadside assistance."
positive,I love it!!
positive,Obviously I just received the tire kit so I can’t attest to how it performs. But it’s all really good quality and will fit my 2021 Hyundai Santa Fe. It even fits in the storage space in the trunk once you take out the storage divider that’s in there. My cat is also a fan
negative,Item runs small and not wide enough for husbands wide feet. The material is stiff and has no give.
positive,Fits my husbands 2007  MX-5 perfectly.
positive,Sons birthday gift
positive,does the job and nice to have around when you need it.
positive,"Made the warning light go off, after replacing this.  2006 Sienna Van."
positive,"This will hold about a full pack of cigarette butts before you have to empty it. If it's getting full, a cigarette butt might not fall into the hole, but if you shake the can a little to settle the butts in the bottom, you get more mileage out of it."
negative,The item did not work on my car.  The screw holes for my power lock were in the wrong place.  I ended up returning item.  Return was very easy.
positive,"My husband and I bought these helmets at Christmas. He was admittedly a little skeptical that they would work as well as advertised (he expected a lot of wind noise interference and thought they'd be as unreliable as the walkie-talkies of his youth) but we decided to try them. Wow, was he glad to be wrong!<br /><br />These helmets made our bicycling trips so much more enjoyable. We can chat while we're riding without having to raise our voices or turn our heads. Wind noise is a rarity and even then, it's not bad enough to overpower our normal speaking voices.<br /><br />Dropped connections are rare and quickly remedied by touching a button on the side of the helmet. The helmets stay in contact for at least half a mile, according to our armature tests.<br /><br /> The battery life is surprisingly long. We got a warning his helmet had low battery but we were able to complete our 14 mile ride without it going dead.<br /><br />We're really glad we bought these and they've made our rides much more enjoyable and companionable."
positive,Perfect replacement turn signal lamp for my 2002 Tacoma
